Title,ID,Collection,Medium,Year,Pricing,Dimensions,Size,x,Notes,Extended description
Cosmic Awakening,ABS-0012,Spiritual Abstracts,"Acrylic on canvas",2024,$1800,71.1*101.6,medium,x,"Featured spiritual piece","A powerful exploration of cosmic consciousness and spiritual awakening. This piece channels deep universal energies through bold abstract forms and luminous color combinations."
Ethereal Transformation,ABS-0013,Spiritual Abstracts,"Mixed media on canvas",2024,$2200,91.4*121.9,large,,"Major transformation work","This artwork represents the profound journey of personal transformation and spiritual evolution. The flowing forms and vibrant energy speak to the soul's journey toward enlightenment."
Divine Radiance,ABS-0014,Spiritual Abstracts,"Oil and gold leaf on panel",2024,$1650,76.2*101.6,medium,x,"Sacred geometry influence","Inspired by sacred geometry and divine light, this piece embodies the radiant energy of spiritual illumination. The geometric patterns flow with organic forms representing the harmony between structure and spirit."
Abstract Symphony,abstract-form,Sample Works,"Acrylic on canvas",2023,$950,76.2*50.8,small,,"Demo piece","A sample abstract work demonstrating the portfolio system."
Ocean Dreams,coastal-breeze,Sample Works,"Watercolor on paper",2023,$750,61*91,medium,,"Coastal inspiration","Sample coastal artwork for portfolio demonstration."
Canyon Vista,feather-canyons,Sample Works,"Oil on canvas",2024,$800,61*76,medium,,"Natural forms","Sample landscape piece showing natural formations."